{
  "schema_version": 1,
  "ok": false,
  "request_id": "request-active-conflict-0001",
  "tool": "dev_flow_open_task",
  "error": {
    "code": "ACTIVE_TASK_CONFLICT",
    "message": "The repository already has an active task with a different contract."
  },
  "recovery": {
    "retry_safe": false,
    "action": "cancel_or_finish_active_task",
    "message": "Finish or cancel the active task before opening another contract."
  }
}
