{
  "schema_version": 1,
  "ok": false,
  "request_id": "request-stale-action-0001",
  "tool": "dev_flow_apply_action",
  "error": {
    "code": "ACTION_STALE",
    "message": "The submitted action identity is no longer current."
  },
  "recovery": {
    "retry_safe": false,
    "action": "read_next_action",
    "message": "Read the persisted next action and use its exact identity."
  }
}
