{
  "schema_version": 1,
  "ok": true,
  "request_id": "request-recovery-read-0003",
  "tool": "dev_flow_get_task",
  "result": {
    "task": {
      "task_id": "task-recovery-0001", "origin_host": "codex",
      "contract": {"goal": "Recover one uncertain action", "scope": ["single repository recovery"], "out_of_scope": ["transport fault injection"], "acceptance_criteria": ["Core classifies the uncertain action."], "verification_budget": {"level": "targeted", "max_automatic_commands": 2, "allow_full_suite": false, "allow_manual_handoff": true}},
      "repository": {"canonical_root": "/workspace/recovery-example", "git_common_dir_digest": "1111111111111111111111111111111111111111111111111111111111111111", "repository_identity": "2222222222222222222222222222222222222222222222222222222222222222", "branch": "main", "detached": false, "head": "aaaaaaaaaaaaaaaaaaaaaaaaaaaaaaaaaaaaaaaa", "unborn": false, "worktree_fingerprint": "3333333333333333333333333333333333333333333333333333333333333333", "observed_at": "2026-01-02T03:06:05Z", "binding_digest": "4444444444444444444444444444444444444444444444444444444444444444"},
      "phase": "PLAN", "resume_phase": null,
      "current_action": {"action_id": "action-implement-0003", "kind": "IMPLEMENT_CHANGE", "task_id": "task-recovery-0001", "revision": 3, "repository_binding_digest": "4444444444444444444444444444444444444444444444444444444444444444", "allowed_effects": ["read_repository", "edit_repository_files"], "required_evidence": [{"kind": "repository_observation", "required": true}, {"kind": "implementation_summary", "required": true}], "payload_contract": "PLAN", "guidance": "Implement only the current plan and report the changed surface.", "issued_at": "2026-01-02T03:06:05Z"},
      "blocker": null,
      "last_operation": {"operation_id": "request-plan-0002", "kind": "apply_action", "action_id": "action-plan-0002", "from_revision": 2, "to_revision": 3, "payload_digest": "5555555555555555555555555555555555555555555555555555555555555555", "committed_at": "2026-01-02T03:06:05Z"},
      "evidence": [], "outcome": null, "revision": 3, "created_at": "2026-01-02T03:04:05Z", "updated_at": "2026-01-02T03:06:05Z", "completed_at": null
    },
    "recovery_assessment": {
      "classification": "partially_completed",
      "operation": {"operation_id": "operation-uncertain-0001", "source_phase": "PLAN", "expected_revision": 3, "action_id": "action-implement-0003", "action_kind": "IMPLEMENT_CHANGE"},
      "task_revision": 3, "current_action_id": "action-implement-0003",
      "issuance_binding_digest": "4444444444444444444444444444444444444444444444444444444444444444", "authoritative_binding_digest": "4444444444444444444444444444444444444444444444444444444444444444", "observed_binding_digest": "8888888888888888888888888888888888888888888888888888888888888888",
      "repository_relation": "worktree_only_changed", "last_operation_relation": "unrelated", "operation_evidence": "none",
      "operation_payload_digest": "6666666666666666666666666666666666666666666666666666666666666666",
      "committed_proof": null, "action_retry_safe": false, "next_advice": "submit_recovery_apply",
      "unblock_condition": {"kind": "restore_issuance_binding", "expected_binding_digest": "4444444444444444444444444444444444444444444444444444444444444444"},
      "observed_at": "2026-01-02T03:07:05Z"
    }
  }
}
