{
  "schema_version": 1,
  "ok": false,
  "request_id": "request-host-conflict-0001",
  "tool": "dev_flow_open_task",
  "error": {
    "code": "HOST_OWNERSHIP_CONFLICT",
    "message": "The active task belongs to another host."
  },
  "recovery": {
    "retry_safe": false,
    "action": "use_origin_host",
    "message": "Resume the task from its origin host."
  }
}
