{
  "schema_version": 1,
  "ok": true,
  "request_id": "request-resolve-blocker-0001",
  "tool": "dev_flow_apply_action",
  "result": {
    "task": {
      "task_id": "task-recovery-0001", "origin_host": "codex",
      "contract": {"goal": "Recover one uncertain action", "scope": ["single repository recovery"], "out_of_scope": ["transport fault injection"], "acceptance_criteria": ["Core classifies the uncertain action."], "verification_budget": {"level": "targeted", "max_automatic_commands": 2, "allow_full_suite": false, "allow_manual_handoff": true}},
      "repository": {"canonical_root": "/workspace/recovery-example", "git_common_dir_digest": "1111111111111111111111111111111111111111111111111111111111111111", "repository_identity": "2222222222222222222222222222222222222222222222222222222222222222", "branch": "main", "detached": false, "head": "aaaaaaaaaaaaaaaaaaaaaaaaaaaaaaaaaaaaaaaa", "unborn": false, "worktree_fingerprint": "3333333333333333333333333333333333333333333333333333333333333333", "observed_at": "2026-01-02T03:08:05Z", "binding_digest": "4444444444444444444444444444444444444444444444444444444444444444"},
      "phase": "PLAN", "resume_phase": null,
      "current_action": {"action_id": "action-implement-0005", "kind": "IMPLEMENT_CHANGE", "task_id": "task-recovery-0001", "revision": 5, "repository_binding_digest": "4444444444444444444444444444444444444444444444444444444444444444", "allowed_effects": ["read_repository", "edit_repository_files"], "required_evidence": [{"kind": "repository_observation", "required": true}, {"kind": "implementation_summary", "required": true}], "payload_contract": "PLAN", "guidance": "Implement only the current plan and report the changed surface.", "issued_at": "2026-01-02T03:08:05Z"},
      "blocker": null,
      "last_operation": {"operation_id": "request-resolve-blocker-0001", "kind": "apply_action", "action_id": "action-resolve-0004", "from_revision": 4, "to_revision": 5, "payload_digest": "bbbbbbbbbbbbbbbbbbbbbbbbbbbbbbbbbbbbbbbbbbbbbbbbbbbbbbbbbbbbbbbb", "committed_at": "2026-01-02T03:08:05Z"},
      "evidence": [{"evidence_id": "evidence-blocker-resolution-0001", "source": "host_observed", "name": "blocker_resolution", "status": "observed", "summary": "The issuance repository binding was restored.", "digest": "cccccccccccccccccccccccccccccccccccccccccccccccccccccccccccccccc", "command_count": 0, "full_suite": false, "recorded_at": "2026-01-02T03:08:05Z"}],
      "outcome": null, "revision": 5,
      "created_at": "2026-01-02T03:04:05Z", "updated_at": "2026-01-02T03:08:05Z", "completed_at": null
    },
    "repository_claim_released": false
  }
}
