{
  "schema_version": 1,
  "ok": false,
  "request_id": "request-repository-drift-0001",
  "tool": "dev_flow_apply_action",
  "error": {
    "code": "REPOSITORY_DRIFT",
    "message": "The fresh repository binding is not permitted for this action."
  },
  "recovery": {
    "retry_safe": false,
    "action": "resolve_repository_drift",
    "message": "Restore or explicitly resolve repository reality before continuing."
  }
}
