{
  "schema_version": 1,
  "ok": true,
  "request_id": "request-server-info-0001",
  "tool": "dev_flow_server_info",
  "result": {
    "product": "dev-flow",
    "version": "${VERSION}",
    "schema_version": 1,
    "transport": "stdio",
    "health": "ready",
    "supported_hosts": [
      "codex",
      "deepseek"
    ],
    "tools": [
      "dev_flow_server_info",
      "dev_flow_open_task",
      "dev_flow_get_task",
      "dev_flow_get_next_action",
      "dev_flow_apply_action",
      "dev_flow_cancel_task"
    ]
  }
}
