{
  "schema_version": 1,
  "ok": true,
  "request_id": "request-get-task-0001",
  "tool": "dev_flow_get_task",
  "result": {
    "task_id": "task-00000001",
    "origin_host": "codex",
    "contract": {
      "goal": "Open a governed task",
      "scope": [
        "task creation",
        "stable task reads"
      ],
      "out_of_scope": [
        "task mutation"
      ],
      "acceptance_criteria": [
        "A persisted ASSESS_TASK action is returned."
      ],
      "verification_budget": {
        "level": "targeted",
        "max_automatic_commands": 2,
        "allow_full_suite": false,
        "allow_manual_handoff": true
      }
    },
    "repository": {
      "canonical_root": "/workspace/example",
      "git_common_dir_digest": "1111111111111111111111111111111111111111111111111111111111111111",
      "repository_identity": "2222222222222222222222222222222222222222222222222222222222222222",
      "branch": "main",
      "detached": false,
      "head": "aaaaaaaaaaaaaaaaaaaaaaaaaaaaaaaaaaaaaaaa",
      "unborn": false,
      "worktree_fingerprint": "3333333333333333333333333333333333333333333333333333333333333333",
      "observed_at": "2026-01-02T03:04:05Z",
      "binding_digest": "4444444444444444444444444444444444444444444444444444444444444444"
    },
    "phase": "INTAKE",
    "resume_phase": null,
    "current_action": {
      "action_id": "action-00000001",
      "kind": "ASSESS_TASK",
      "task_id": "task-00000001",
      "revision": 1,
      "repository_binding_digest": "4444444444444444444444444444444444444444444444444444444444444444",
      "allowed_effects": [
        "read_repository"
      ],
      "required_evidence": [
        {
          "kind": "repository_observation",
          "required": true
        },
        {
          "kind": "assessment_summary",
          "required": true
        }
      ],
      "payload_contract": "INTAKE",
      "guidance": "Assess the task contract and repository without modifying source files.",
      "issued_at": "2026-01-02T03:04:05Z"
    },
    "blocker": null,
    "last_operation": {
      "operation_id": "request-open-task-0001",
      "kind": "open_task",
      "action_id": null,
      "from_revision": 0,
      "to_revision": 1,
      "payload_digest": "5555555555555555555555555555555555555555555555555555555555555555",
      "committed_at": "2026-01-02T03:04:05Z"
    },
    "evidence": [],
    "outcome": null,
    "revision": 1,
    "created_at": "2026-01-02T03:04:05Z",
    "updated_at": "2026-01-02T03:04:05Z",
    "completed_at": null
  }
}
