{
  "schema_version": 1,
  "ok": true,
  "request_id": "request-recovery-read-0005",
  "tool": "dev_flow_get_task",
  "result": {
    "task": {
      "task_id": "task-recovery-0001", "origin_host": "codex",
      "contract": {"goal": "Recover one uncertain action", "scope": ["single repository recovery"], "out_of_scope": ["transport fault injection"], "acceptance_criteria": ["Core classifies the uncertain action."], "verification_budget": {"level": "targeted", "max_automatic_commands": 2, "allow_full_suite": false, "allow_manual_handoff": true}},
      "repository": {"canonical_root": "/workspace/recovery-example", "git_common_dir_digest": "1111111111111111111111111111111111111111111111111111111111111111", "repository_identity": "2222222222222222222222222222222222222222222222222222222222222222", "branch": "main", "detached": false, "head": "aaaaaaaaaaaaaaaaaaaaaaaaaaaaaaaaaaaaaaaa", "unborn": false, "worktree_fingerprint": "3333333333333333333333333333333333333333333333333333333333333333", "observed_at": "2026-01-02T03:07:05Z", "binding_digest": "4444444444444444444444444444444444444444444444444444444444444444"},
      "phase": "IMPLEMENT", "resume_phase": null,
      "current_action": {"action_id": "action-verify-0004", "kind": "VERIFY_CHANGE", "task_id": "task-recovery-0001", "revision": 4, "repository_binding_digest": "4444444444444444444444444444444444444444444444444444444444444444", "allowed_effects": ["read_repository", "run_verification_commands"], "required_evidence": [{"kind": "repository_observation", "required": true}, {"kind": "verification_summary", "required": true}], "payload_contract": "IMPLEMENT", "guidance": "Verify the implementation within the task verification budget.", "issued_at": "2026-01-02T03:07:05Z"},
      "blocker": null,
      "last_operation": {"operation_id": "operation-uncertain-0001", "kind": "apply_action", "action_id": "action-implement-0003", "from_revision": 3, "to_revision": 4, "payload_digest": "7777777777777777777777777777777777777777777777777777777777777777", "committed_at": "2026-01-02T03:07:05Z"},
      "evidence": [{"evidence_id": "evidence-implementation-0001", "source": "host_observed", "name": "implementation_summary", "status": "observed", "summary": "The no-file-change implementation completed.", "digest": "aaaaaaaaaaaaaaaaaaaaaaaaaaaaaaaaaaaaaaaaaaaaaaaaaaaaaaaaaaaaaaaa", "command_count": 0, "full_suite": false, "recorded_at": "2026-01-02T03:07:05Z"}],
      "outcome": null, "revision": 4, "created_at": "2026-01-02T03:04:05Z", "updated_at": "2026-01-02T03:07:05Z", "completed_at": null
    },
    "recovery_assessment": {
      "classification": "completed_and_recorded",
      "operation": {"operation_id": "operation-uncertain-0001", "source_phase": "PLAN", "expected_revision": 3, "action_id": "action-implement-0003", "action_kind": "IMPLEMENT_CHANGE"},
      "task_revision": 4, "current_action_id": "action-verify-0004",
      "issuance_binding_digest": "4444444444444444444444444444444444444444444444444444444444444444", "authoritative_binding_digest": "4444444444444444444444444444444444444444444444444444444444444444", "observed_binding_digest": "4444444444444444444444444444444444444444444444444444444444444444",
      "repository_relation": "exact", "last_operation_relation": "exact", "operation_evidence": "complete",
      "operation_payload_digest": "7777777777777777777777777777777777777777777777777777777777777777",
      "committed_proof": {"operation_id": "operation-uncertain-0001", "kind": "apply_action", "action_id": "action-implement-0003", "from_revision": 3, "to_revision": 4, "payload_digest": "7777777777777777777777777777777777777777777777777777777777777777", "committed_at": "2026-01-02T03:07:05Z"},
      "action_retry_safe": false, "next_advice": "read_next_action", "unblock_condition": null,
      "observed_at": "2026-01-02T03:08:05Z"
    }
  }
}
