{
  "schema_version": 1,
  "ok": true,
  "request_id": "request-recovery-block-0001",
  "tool": "dev_flow_apply_action",
  "result": {
    "task": {
      "task_id": "task-recovery-0001", "origin_host": "codex",
      "contract": {"goal": "Recover one uncertain action", "scope": ["single repository recovery"], "out_of_scope": ["transport fault injection"], "acceptance_criteria": ["Core classifies the uncertain action."], "verification_budget": {"level": "targeted", "max_automatic_commands": 2, "allow_full_suite": false, "allow_manual_handoff": true}},
      "repository": {"canonical_root": "/workspace/recovery-example", "git_common_dir_digest": "1111111111111111111111111111111111111111111111111111111111111111", "repository_identity": "2222222222222222222222222222222222222222222222222222222222222222", "branch": "main", "detached": false, "head": "aaaaaaaaaaaaaaaaaaaaaaaaaaaaaaaaaaaaaaaa", "unborn": false, "worktree_fingerprint": "3333333333333333333333333333333333333333333333333333333333333333", "observed_at": "2026-01-02T03:06:05Z", "binding_digest": "4444444444444444444444444444444444444444444444444444444444444444"},
      "phase": "BLOCKED", "resume_phase": "PLAN",
      "current_action": {"action_id": "action-resolve-0004", "kind": "RESOLVE_BLOCKER", "task_id": "task-recovery-0001", "revision": 4, "repository_binding_digest": "4444444444444444444444444444444444444444444444444444444444444444", "allowed_effects": ["read_repository", "resolve_blocker"], "required_evidence": [{"kind": "repository_observation", "required": true}, {"kind": "blocker_resolution", "required": true}], "payload_contract": "BLOCKED", "guidance": "Satisfy the stored blocker condition and return only to its resume phase.", "issued_at": "2026-01-02T03:07:05Z"},
      "blocker": {
        "blocker_id": "blocker-recovery-0001", "code": "TASK_BLOCKED", "cause": "conflicting",
        "message": "Recovery evidence conflicts with the authoritative task state.", "resume_phase": "PLAN",
        "observed_binding_digest": "9999999999999999999999999999999999999999999999999999999999999999",
        "condition": {"kind": "restore_issuance_binding", "expected_binding_digest": "4444444444444444444444444444444444444444444444444444444444444444"},
        "required_resolution": "Restore the repository binding issued for the blocked action, then submit its resolution.",
        "created_at": "2026-01-02T03:07:05Z"
      },
      "last_operation": {"operation_id": "operation-uncertain-0001", "kind": "apply_action", "action_id": "action-implement-0003", "from_revision": 3, "to_revision": 4, "payload_digest": "7777777777777777777777777777777777777777777777777777777777777777", "committed_at": "2026-01-02T03:07:05Z"},
      "evidence": [], "outcome": null, "revision": 4,
      "created_at": "2026-01-02T03:04:05Z", "updated_at": "2026-01-02T03:07:05Z", "completed_at": null
    },
    "repository_claim_released": false
  }
}
