{
  "schema_version": 1,
  "ok": false,
  "request_id": "request-revision-conflict-0001",
  "tool": "dev_flow_apply_action",
  "error": {
    "code": "REVISION_CONFLICT",
    "message": "The submitted task revision is stale."
  },
  "recovery": {
    "retry_safe": false,
    "action": "read_task",
    "message": "Read the authoritative task before deciding whether another mutation is safe."
  }
}
