{
  "schema_version": 1,
  "ok": true,
  "request_id": "request-complete-handoff-0001",
  "tool": "dev_flow_apply_action",
  "result": {
    "task": {
      "task_id": "task-00000001",
      "origin_host": "codex",
      "contract": {
        "goal": "Complete one governed workflow",
        "scope": [
          "in-process workflow"
        ],
        "out_of_scope": [
          "process restart"
        ],
        "acceptance_criteria": [
          "The task reaches DONE and releases its repository claim."
        ],
        "verification_budget": {
          "level": "targeted",
          "max_automatic_commands": 2,
          "allow_full_suite": false,
          "allow_manual_handoff": true
        }
      },
      "repository": {
        "canonical_root": "/workspace/example",
        "git_common_dir_digest": "1111111111111111111111111111111111111111111111111111111111111111",
        "repository_identity": "2222222222222222222222222222222222222222222222222222222222222222",
        "branch": "main",
        "detached": false,
        "head": "aaaaaaaaaaaaaaaaaaaaaaaaaaaaaaaaaaaaaaaa",
        "unborn": false,
        "worktree_fingerprint": "6666666666666666666666666666666666666666666666666666666666666666",
        "observed_at": "2026-01-02T03:11:05Z",
        "binding_digest": "7777777777777777777777777777777777777777777777777777777777777777"
      },
      "phase": "DONE",
      "resume_phase": null,
      "current_action": null,
      "blocker": null,
      "last_operation": {
        "operation_id": "request-complete-handoff-0001",
        "kind": "apply_action",
        "action_id": "action-handoff-0007",
        "from_revision": 7,
        "to_revision": 8,
        "payload_digest": "dddddddddddddddddddddddddddddddddddddddddddddddddddddddddddddddd",
        "committed_at": "2026-01-02T03:11:05Z"
      },
      "evidence": [
        {
          "evidence_id": "evidence-automated-0001",
          "source": "automated",
          "name": "targeted-unit",
          "status": "passed",
          "summary": "Targeted unit verification passed.",
          "digest": "eeeeeeeeeeeeeeeeeeeeeeeeeeeeeeeeeeeeeeeeeeeeeeeeeeeeeeeeeeeeeeee",
          "command_count": 1,
          "full_suite": false,
          "recorded_at": "2026-01-02T03:09:05Z"
        },
        {
          "evidence_id": "evidence-user-0001",
          "source": "user",
          "name": "user-confirmation",
          "status": "passed",
          "summary": "The user confirmed the retained acceptance result.",
          "digest": "ffffffffffffffffffffffffffffffffffffffffffffffffffffffffffffffff",
          "command_count": 0,
          "full_suite": false,
          "recorded_at": "2026-01-02T03:09:05Z"
        }
      ],
      "outcome": {
        "status": "completed",
        "acceptance": [
          {
            "criterion": "The task reaches DONE and releases its repository claim.",
            "status": "satisfied"
          }
        ],
        "automated_evidence_ids": [
          "evidence-automated-0001"
        ],
        "manual_evidence_ids": [
          "evidence-user-0001"
        ],
        "unverified_items": [],
        "risks": [
          "Process restart remains outside this checkpoint."
        ],
        "final_repository_binding_digest": "7777777777777777777777777777777777777777777777777777777777777777",
        "summary": "The in-process governed workflow is complete.",
        "completed_at": "2026-01-02T03:11:05Z"
      },
      "revision": 8,
      "created_at": "2026-01-02T03:04:05Z",
      "updated_at": "2026-01-02T03:11:05Z",
      "completed_at": "2026-01-02T03:11:05Z"
    },
    "repository_claim_released": true
  }
}
